Titel,Sender,Jahr,Regie,LB ★,MUBI ★,Stimmen,Dauer (min),Hinzugefügt am,Beschreibung,Mediathek-Link,Letterboxd-Link
Paris kann warten,ARD,,Eleanor Coppola,2.85,,5808,87,25.05.2026,"Anne is at a crossroads in her life. Long married to a successful, driven but inattentive movie producer, she unexpectedly finds herself taking a car trip from Cannes to Paris with Jacques, a business associate of her husband. What should be a seven-hour drive turns into a carefree two-day adventure replete with diversions involving picturesque sights, fine food and wine, humor, wisdom and romance - reawakening Anne's senses and giving her a new lust for life.",https://www.ardmediathek.de/video/Y3JpZDovL2FyZC5kZS9wbGFuQVJEX2UxMjQ1MzcxLWRlZjYtNDFjYy05ODUxLWFlY2MxNWNlMjkyMF9nYW56ZVNlbmR1bmc,https://letterboxd.com/film/paris-can-wait/
La Maison - Haus der Lust,3Sat,,Anissa Bonnefont,2.81,,2535,84,01.09.2025,"Emma, a French novelist aged 27, decide to go to Berlin and join a brothel to uncover the prostitution world, the subject of her new book. Such as gonzo journalism, Emma become a prostitute and her experience, which was supposed to last a few weeks, will last two years. Was writing her book an excuse for Emma to live a shameful fantasy?",https://www.3sat.de/film/spielfilm/la-maison---haus-der-lust-100.html,https://letterboxd.com/film/the-house-2022/
"Es ist nur eine Phase, Hase",3Sat,,Florian Gallenberger,2.78,,1249,99,21.06.2026,"The successful writer Paul and the sought-after voice actress Emilia were always considered to be the absolute dream couple by friends: Harmonious, happy, successful, with three charming children named Bo, Marie and Fe. But now, in their late 40s, their relationship is threatened by a crisis.",https://www.3sat.de/film/spielfilm/es-ist-nur-eine-phase-hase-100.html,https://letterboxd.com/film/its-just-a-phase-honeybunny/
Liebe auf 4 Pfoten,ZDF,,Finn Taylor,2.78,,1028,90,14.06.2026,"When a cosmic event turns Emma's dog and cat into two perfect guys, Emma reconsiders her outlook on dating, hilariously works out her trust issues, and ultimately learns to love herself.",https://www.zdf.de/filme/liebe-auf-4-pfoten-movie-100,https://letterboxd.com/film/unleashed-2017/
Alibi.com 2,ZDF,,Philippe Lacheau,2.78,,29601,84,26.06.2026,"After closing his agency Alibi.com and promising Flo that he would never lie to her again, Greg's new life became quiet, too quiet... Not for long! When he decides to propose to Flo, Greg is up against the wall and has to introduce his family. But with his crooked father and his ex-charm actress mother, this could ruin his future union. He has no choice but to reopen his agency with his former accomplices for an ultimate Alibi and to find more presentable fake parents.",https://www.zdf.de/filme/alibicom-2-movie-100,https://letterboxd.com/film/alibicom-2/
See for Me - Der unsichtbare Feind,ZDF,,Randall Okita,2.75,,17101,84,28.05.2026,"When blind former Olympic skier Sophie Scott cat-sits in a secluded mansion, she gets caught in the crossfire of a home invasion scheme. She must rely on a sighted Army veteran via the See for Me app to help her survive the night.",https://www.zdf.de/filme/see-for-me---der-unsichtbare-feind-movie-100,https://letterboxd.com/film/see-for-me/
Curiosa - Die Kunst der Verführung,3Sat,,Lou Jeunet,2.68,,9411,100,06.01.2026,"A passionate love story set against a backdrop of sexual freedom, loosely based on the relationship between 19th century authors Pierre Louÿs and Marie de Régnier.",https://www.3sat.de/film/spielfilm/curiosa---die-kunst-der-verfuehrung-100.html,https://letterboxd.com/film/curiosa/
Staying Alive,ARTE.DE,,Sylvester Stallone,2.6,,13883,92,25.06.2026,It's five years later and Tony Manero's Saturday Night Fever is still burning. Now he's strutting toward his biggest challenger yet - making it as a dancer on the Broadway stage.,https://www.arte.tv/de/videos/130330-000-A/staying-alive/,https://letterboxd.com/film/staying-alive/
Close,3Sat,,Vicky Jewson,2.58,,13235,99,22.03.2025,"A counter-terrorism expert takes a job protecting a young heiress. After an attempted kidnapping puts both of their lives in danger, they must flee.",https://www.3sat.de/film/spielfilm/close-100.html,https://letterboxd.com/film/close-2019/
Jagen auf Französisch,ZDF,,"Antonin Fourlon, Frédéric Forestier",2.58,,9197,96,21.06.2026,"Flanked by their two children, Simon and Adélaïde decide, like many Parisians today, to leave their two-room apartment for a quieter and more comfortable life in the country. They are seduced by a house in the middle of nature: space, a vegetable garden, a wood adjoining their garden and above all villagers who welcome them with open arms. A dream come true! But the young couple was soon to be disillusioned: the wood was actually a hunting ground for big game! Although the hunters are friendly, they are not willing to give up their territory, making Simon and Adélaïde's dream of the countryside a living hell. But true to their reputation, our Parisians are not going to let them do it.",https://www.zdf.de/filme/jagen-auf-franzoesisch-movie-100,https://letterboxd.com/film/open-season-2023/
Last Dance,3Sat,,Kelly Marcel,2.55,,561299,82,29.03.2026,"Eddie and Venom are on the run. Hunted by both of their worlds and with the net closing in, the duo are forced into a devastating decision that will bring the curtains down on Venom and Eddie's last dance.",https://www.3sat.de/film/spielfilm/last-dance-100.html,https://letterboxd.com/film/venom-the-last-dance/
Bluff,ARD,,Frank E. Flowers,2.54,,28608,103,13.06.2026,"When her tranquil life on a remote island is shattered by the return of her vengeful former captain, a skilled ex-pirate must confront her bloody past and unleash her deadly talents to save her family from a ruthless siege.",https://www.ardmediathek.de/video/Y3JpZDovL2FyZC5kZS9wbGFuQVJEX2I3NzBiZjBhLTIxZDgtNDcwYy05MTE3LWRmMTI3ZTk1OTI1Ml9nYW56ZVNlbmR1bmc,https://letterboxd.com/film/the-bluff-2026/
Die Spur der Knochen,ZDF,,Jorge Dorado,2.52,,2189,99,01.06.2026,"Mario, a worker in ""lost and found"" department, finds a suitcase with a dead baby inside.",https://www.zdf.de/filme/die-spur-der-knochen-movie-100,https://letterboxd.com/film/lost-found-2022/
Vanished - Tage der Angst,ZDF,,Peter Facinelli,2.49,,10203,110,08.06.2026,"A family vacation takes a terrifying turn when parents Paul and Wendy discover their young daughter has vanished without a trace. Stopping at nothing to find her, the search for the truth leads to a shocking revelation.",https://www.zdf.de/filme/vanished---tage-der-angst-movie-100,https://letterboxd.com/film/the-vanished-2020/
Into the Beat - Dein Herz tanzt,ZDF-tivi,,Stefan Westerwelle,2.43,,3902,92,30.04.2026,"Katya is a young, outstanding and upcoming ballet dancer. In just a few weeks she is due to have a major audition for the New York Ballet Academy and Katya has good chances of getting a scholarship. But when she meets a group of street-dancers the girl dives into a completely new world.",https://www.zdf.de/filme/into-the-beat---dein-herz-tanzt-movie-100,https://letterboxd.com/film/into-the-beat/
"Berlin, Berlin - Der Kinofilm",3Sat,,Franziska Meyer Price,2.39,,769,73,31.08.2025,"Lolle's love life in Berlin is as complicated as ever. After the story with Sven, her second cousin, was over, she got together with her best friend Hart and the two are about to get married. That is, if Sven doesn't ruin things.",https://www.3sat.de/film/spielfilm/berlin-berlin---der-kinofilm-100.html,https://letterboxd.com/film/berlin-berlin/
Canary Black,ZDF,,Pierre Morel,2.28,,8584,98,11.06.2026,"Top level CIA agent Avery Graves is blackmailed by terrorists into betraying her own country to save her kidnapped husband. Cut off from her team, she turns to her underworld contacts to survive and help locate the coveted intelligence that the kidnappers want.",https://www.zdf.de/filme/canary-black-movie-100,https://letterboxd.com/film/canary-black/
