Titel,Sender,Jahr,Regie,LB ★,MUBI ★,Stimmen,Dauer (min),Hinzugefügt am,Beschreibung,Mediathek-Link,Letterboxd-Link
Leberkäsjunkie,ARD,,Ed Herzog,3.31,,3315,89,23.06.2026,"While dealing with a burnt-down house, smelly diapers and brutal lack of sleep, a Lower Bavarian police officer faces his worst adversary: cholesterol.",https://www.ardmediathek.de/video/Y3JpZDovL2FyZC5kZS9iZWYzNWM2MC1kNzNhLTRmZWYtYWM4NS1iMWQwMmNkYzIwZDlfZ2FuemVTZW5kdW5n,https://letterboxd.com/film/leberkasjunkie/
The Card Counter,3Sat,,Paul Schrader,3.3,,132077,107,07.11.2025,"William Tell just wants to play cards. His spartan existence on the casino trail is shattered when he is approached by Cirk, a vulnerable and angry young man seeking help to execute his plan for revenge on a military colonel. Tell sees a chance at redemption through his relationship with Cirk. But keeping Cirk on the straight-and-narrow proves impossible, dragging Tell back into the darkness of his past.",https://www.3sat.de/film/spielfilm/the-card-counter-100.html,https://letterboxd.com/film/the-card-counter/
Shorta – Das Gesetz der Straße,3Sat,,"Anders Ølholm, Frederik Louis Hviid",3.3,,5129,101,30.11.2025,"The exact details of what took place while Talib Ben Hassi was in police custody remain unclear. Police officers Jens and Mike are on routine patrol in Svalegården's ghetto when news of Talib's death comes in over the radio, igniting uncontrollable, pent-up rage in the ghetto's youth, who lust for revenge. Suddenly, the two officers find themselves fair game and must fight tooth and claw to find a way out.",https://www.3sat.de/film/spielfilm/shorta-das-gesetz-der-strasse-100.html,https://letterboxd.com/film/enforcement/
Robin Hood - König der Diebe,3Sat,,Kevin Reynolds,3.28,,109370,148,25.12.2025,"Nobleman crusader Robin of Locksley breaks out of a Jerusalem prison with the help of Moorish fellow prisoner Azeem and travels back home to England. But upon arrival he discovers his dead father in the ruins of his family estate, killed by the vicious sheriff of Nottingham, Robin and Azeem join forces with outlaws Little John and Will Scarlett to save the kingdom from the sheriff's villainy.",https://www.3sat.de/film/spielfilm/robin-hood---koenig-der-diebe-100.html,https://letterboxd.com/film/robin-hood-prince-of-thieves/
Kämpferin,ARTE.DE,,Agustín Díaz Yanes,3.27,,10175,91,19.01.2026,"A young agent leaves everything behind to pose as a member of ETA, risking her life to uncover the terrorists' hideouts in the south of France.",https://www.arte.tv/de/videos/129908-000-A/kaempferin/,https://letterboxd.com/film/she-walks-in-darkness/
Der Graf mit der eisernen Faust,ARTE.DE,,André Hunebelle,3.26,,453,101,05.04.2026,The Marquis Rodolphe de Sombrueil accidentally runs over a working man with his carriage and helps his widow -- unjustly accused of robbery -- to find her missing daughter.,https://www.arte.tv/de/videos/117111-000-A/der-graf-mit-der-eisernen-faust/,https://letterboxd.com/film/the-mysteries-of-paris/
Die Päpstin,ZDFneo,,Sönke Wortmann,3.25,,3277,142,21.06.2026,A 9th century woman of English extraction born in the German city of Ingelheim disguises herself as a man and rises through the Vatican ranks.,https://www.zdf.de/filme/die-paepstin-movie-100,https://letterboxd.com/film/pope-joan-2009/
Leere Netze,ARTE.DE,,Behrooz Karamizade,3.25,,797,95,04.07.2025,"Amir, a young Iranian, signs on with a fisherman on the rugged Caspian Sea coast in order to earn the money he needs to marry his sweetheart, Narges. But in so doing, he becomes entangled in the criminal machinations of caviar poaching. Piece by piece, a complex hierarchy is revealed in a parallel realm that becomes ever more constricting and oppressive, endangering Amir’s relationship with Narges as well.",https://www.arte.tv/de/videos/098318-000-A/leere-netze/,https://letterboxd.com/film/empty-nets/
Mein Ende. Dein Anfang.,3Sat,,Mariko Minoguchi,3.24,,891,106,08.03.2025,"The fate of Nora, a supermarket cashier who lives happily with her boyfriend Aron, and that of Natan, a loving father who works as a night watchman, cross paths when misfortune turns their lives upside down.",https://www.3sat.de/film/spielfilm/mein-ende-dein-anfang-104.html,https://letterboxd.com/film/relativity-2019/
Meine chaotische Hochzeit,3Sat,,Wayne Blair,3.24,,2996,97,10.06.2025,"Lauren and Ned are engaged, they are in love, and they have just ten days to find Lauren’s mother who has gone AWOL somewhere in the remote far north of Australia, reunite her parents and pull off their dream wedding.",https://www.3sat.de/film/spielfilm/meine-chaotische-hochzeit-100.html,https://letterboxd.com/film/top-end-wedding/
"Kinder, Küche, Chaos",ARTE.DE,,Isabelle Czajka,3.22,,654,91,13.03.2019,"Juliette was simply not sure about coming to live in this residential suburb of the greater Paris metropolitan area. All the women here are in their forties, have children to raise, houses to keep and husbands who return home late at night.Today she has an appointment in Paris that is important for her career, but she also has to run errands and pick up the kids from school. During the course of her day, monopolized by petty, everyday tasks, Juliette can feel the noose of domestic obligations and household chores slowly tightening around her neck.",https://www.arte.tv/de/videos/083838-000-A/kinder-kueche-chaos/,https://letterboxd.com/film/domestic-life/
Guglhupfgeschwader,3Sat,,Ed Herzog,3.22,,2875,90,16.02.2026,Bavaria's most relaxed village policeman has to face an organized crime syndicate coming after his grandmother's cakes.,https://www.3sat.de/film/spielfilm/guglhupfgeschwader-100.html,https://letterboxd.com/film/guglhupfgeschwader/
Saturday Night Fever - Nur Samstag Nacht,3Sat,,John Badham,3.21,,167883,114,21.06.2025,Tony spends his Saturdays at a disco where his stylish moves raise his popularity among the patrons. But his life outside the disco is not easy and things change when he gets attracted to Stephanie.,https://www.3sat.de/film/spielfilm/saturday-night-fever---nur-samstag-nacht-100.html,https://letterboxd.com/film/saturday-night-fever/
Zu guter Letzt,3Sat,,Mark Pellington,3.21,,5466,100,02.03.2025,"A retired businesswoman – who tries to control everything around her – decides to write her own obituary. A young journalist takes up the task of finding out the truth, and the result is a life-altering friendship.",https://www.3sat.de/film/spielfilm/zu-guter-letzt-100.html,https://letterboxd.com/film/the-last-word-2017/
Die Saat,3Sat,,Mia Maariel Meyer,3.21,,294,97,24.05.2025,"Rainer toils by the sweat of his brow on a building site. His first job as site manager is his much-needed big break. Rising rents in the city have already forced him, his pregnant wife and 13-year-old daughter Doreen to move into a little house in the outskirts which needs renovating. At first, Doreen is not thrilled about her new life but then she meets her neighbour Mara, a girl whose parents are as rich as they are narrow-minded. Before long the new friends are playing with fire. Mara incites Doreen to play some nasty tricks and also entangles her in a theft.",https://www.3sat.de/film/spielfilm/die-saat-102.html,https://letterboxd.com/film/the-seed-2021/
Die Mitte der Welt,3Sat,,Jakob M. Erwa,3.18,,10944,110,28.02.2026,"A strange family: 17-year-old Phil lives with his mother and twin sister in an old mansion on the outskirts of town. When he returns from summer camp, the mood in the mansion has soured somehow. Phil doesn’t worry about it, hanging out with his best friend Kat instead. When he starts to feel attracted to a mysterious new student at school, Phil is plunged into emotional turmoil only exacerbated by the trouble at home.",https://www.3sat.de/film/spielfilm/die-mitte-der-welt-100.html,https://letterboxd.com/film/center-of-my-world/
Rosalie,ARTE.DE,,W.S. Van Dyke,3.18,,225,108,24.06.2026,"West Point cadet Dick Thorpe falls in love with a girl, who turns out to be a princess from an European kingdom.",https://www.arte.tv/de/videos/125582-000-A/rosalie/,https://letterboxd.com/film/rosalie/
Never Grow Old,3Sat,,Ivan Kavanagh,3.18,,2944,95,29.08.2025,"An Irish undertaker profits when outlaws take over a peaceful town, but his own family come under threat as the death toll increases dramatically.",https://www.3sat.de/film/spielfilm/never-grow-old-100.html,https://letterboxd.com/film/never-grow-old/
Der Schut,ARD,,Robert Siodmak,3.17,,479,110,25.05.2026,"When a villain named ""Der Schut"" terrorizes the constituents of Albanian country, which he rules, heroic Kara Ben Nemsi and his sidekick are the only ones who can stop him.",https://www.ardmediathek.de/video/Y3JpZDovL2FyZC5kZS9lZDBmZTIyYi1hZmVjLTQzMTctYmFmNi1kYzdhN2JmZTkzNDFfZ2FuemVTZW5kdW5n,https://letterboxd.com/film/yellow-devil/
I See You – Das Böse ist näher als du denkst,3Sat,,Adam Randall,3.17,,138210,87,15.03.2026,"When a 12-year-old boy goes missing at a local park, a detective investigates the case to help the boy's family find answers.",https://www.3sat.de/film/spielfilm/i-see-you-das-boese-ist-naeher-als-du-denkst-100.html,https://letterboxd.com/film/i-see-you-2019/
Im Netz der Gewalt,3Sat,,Joel Souza,3.16,,2781,105,14.03.2025,"One memorable night in the life of veteran patrol officer Ray Mandel and his trainee, ambitious rookie cop Nick Holland in the LAPD's Olympic Division. With two cop killers on the loose and hunting for more targets, Mandel and Holland must contend with a city about to boil over, as well as Jack VanZandt, an unhinged rogue cop out for payback running wild in their patrol zone.",https://www.3sat.de/film/spielfilm/im-netz-der-gewalt-100.html,https://letterboxd.com/film/crown-vic/
Banditen!,3Sat,,Barry Levinson,3.15,,26253,117,13.03.2026,"After escaping from prison, Joe and Terry go on a crime spree, robbing banks through Oregon and California in order to finance their scheme for a new life south of the border. Unfortunately, things get more complicated when they meet Kate, who runs into them with her car. She joins the bandits on their cross-country spree, and eventually she steals something, too: their hearts.",https://www.3sat.de/film/spielfilm/banditen-100.html,https://letterboxd.com/film/bandits-2001/
Enkel für Anfänger,ARD,,Wolfgang Groos,3.15,,836,97,27.06.2026,"Retirees Karin, Gerhard and Philippa are not in the mood for Nordic walking and seniors' courses at the university. When Philippa, who is living life to the full as Leonie's godmother, helps the two to unexpected grandparenthood, they suddenly have two ""lively"" god-grandchildren to look after, a huge bouncy castle standing in the garden and Lego bricks stuck to their feet.",https://www.ardmediathek.de/video/Y3JpZDovL2FyZC5kZS9wbGFuQVJEXzA4NTc3NDVlLTAxZTctNDJiZC1hMGI0LTEzZjE1ZGNiZGY3N19nYW56ZVNlbmR1bmc,https://letterboxd.com/film/granny-nanny/
Der Effekt des Wassers,ARTE.DE,,Sólveig Anspach,3.15,,1534,77,09.05.2018,"Samir, a lanky crane operator in Montreuil, falls madly for Agathe. As master swimmer at the pool Thorez he decides to take swimming lessons with her. But the lie does not last three lessons - Agathe hate liars. Chosen to represent the Seine-Saint-Denis, Agathe flies to Iceland for the 10th Congress of the International Masters Swimming. Samir has no choice but to fly in turn also.",https://www.arte.tv/de/videos/080049-000-A/der-effekt-des-wassers/,https://letterboxd.com/film/the-together-project/
Gold,ARTE.DE,,Stephen Gaghan,3.14,,31919,119,11.04.2026,"Kenny Wells, a modern-day prospector, hustler, and dreamer, is desperate for a lucky break. Left with few options, Wells teams up with an equally luckless geologist to execute a grandiose, last-ditch effort: to find gold deep in the uncharted jungle of Indonesia.",https://www.arte.tv/de/videos/129822-000-A/gold/,https://letterboxd.com/film/gold-2016/
Fräulein Smillas Gespür für Schnee,3Sat,,Bille August,3.14,,5304,113,27.12.2025,"Smilla Jaspersen attempts to understand the death of a small boy who falls from the roof of her apartment building. Suspecting wrongdoing, Smilla uncovers a trail of clues leading towards a secretive corporation that has made several mysterious expeditions to Greenland.",https://www.3sat.de/film/spielfilm/fraeulein-smillas-gespuer-fuer-schnee-100.html,https://letterboxd.com/film/smillas-sense-of-snow/
Das Mädchen deiner Träume,ZDF,,Luke Eve,3.14,,2224,104,22.06.2026,"An aspiring musician struggling with schizophrenia falls for a mysterious woman who may be all in his head. When she suddenly vanishes, he takes off on a cross-country journey across Australia to find her, forcing his long-suffering brother to chase after him.",https://www.zdf.de/filme/das-maedchen-deiner-traeume-movie-100,https://letterboxd.com/film/i-met-a-girl/
Madame Annie und ihre Familie,ZDF,,Emmanuel Poulain-Arnaud,3.14,,2384,76,18.06.2026,"Annie lives in harmony with her husband Laurent and her children: the sensitive elders Maximilien and César; the younger Antoine whom Poupi, never-complaining teen, helps raising him. But a positive pregnancy test will disturb the harmony.",https://www.zdf.de/filme/madame-annie-und-ihre-familie-movie-100,https://letterboxd.com/film/the-test-2021-1/
Pettersson und Findus - Findus zieht um,ZDF-tivi,,Ali Samadi Ahadi,3.14,,217,73,08.06.2026,"The old man Petterson is trying to sleep but his cat Findus is keeping him awake, so they both agree that Findus shall have his own house.",https://www.zdf.de/animation/pettersson-und-findus---findus-zieht-um-movie-100,https://letterboxd.com/film/pettson-and-findus-findus-moves-house/
Eine Frau mit berauschenden Talenten,3Sat,,Jean-Paul Salomé,3.12,,5712,97,16.08.2025,A translator working for the police gets involved in the other side of drug dealing.,https://www.3sat.de/film/spielfilm/eine-frau-mit-berauschenden-talenten-104.html,https://letterboxd.com/film/mama-weed/
22 Kugeln – Die Rache des Profis,3Sat,,Richard Berry,3.11,,11363,104,05.12.2025,A retired mobster goes on a revenge spree after being left for dead with 22 bullets in his body by his former childhood friend.,https://www.3sat.de/film/spielfilm/22-kugeln-die-rache-des-profis-106.html,https://letterboxd.com/film/22-bullets/
Alles gelogen,ZDF,,Erik Haffner,3.11,,368,88,13.05.2026,"Hajo Siewers lives with his wife Vera and his teenage son Marvin in a residential area for single family homes. He has a tendency to stretch the limits between truth and lies. One day, he might have gone too far and risks to lose everything he loves.",https://www.zdf.de/filme/alles-gelogen-movie-100,https://letterboxd.com/film/alles-gelogen/
Mo Hayder: Ritualmord,ZDF,,Hans Herbots,3.1,,977,118,28.06.2026,"The discovery of a chopped-off hand in a Brussels canal forces Belgian police diver Kiki to face deep guilt from the past, her own and her country’s.  Based on the book ‘Ritual’ by Mo Hayder.",https://www.zdf.de/filme/mo-hayder-ritualmord-movie-100,https://letterboxd.com/film/ritual-2022/
Die Pyramide des Sonnengottes,3Sat,,Robert Siodmak,3.09,,299,94,24.05.2026,"Mexico, 1864. The country is divided by the struggle against the French occupation and emperor Maximilian. The German doctor Karl Sternau and his friend Andreas Hasenpfeffer come to love the country and support the cause of the proud Mexicans.",https://www.3sat.de/film/spielfilm/die-pyramide-des-sonnengottes-100.html,https://letterboxd.com/film/pyramid-of-the-sun-god/
Kein Wort,ARTE.DE,,Hanna Antonina Wojcik-Slak,3.09,,394,79,22.06.2026,"On a barren island, a mother and son confront years of silence and misunderstandings in writer-director Hanna Slak’s formidable fourth feature film starring Maren Eggert, scored by Amélie Legrand, and shot by Claire Mathon.",https://www.arte.tv/de/videos/105548-000-A/kein-wort/,https://letterboxd.com/film/not-a-word-2023/
Mein Lotta-Leben – Alles Tschaka mit Alpaka!,ZDF-tivi,,Martina Plura,3.08,,215,78,10.06.2026,"Lotta Petermann is looking forward to her first class trip. Finally without parents and with her best friends Amrum unsicher machen - that promises pure adventure! But Mama Sabine sabotages Lotta's plans and suggests Papa Rainer, of all people, to accompany her on the class trip - how embarrassing!",https://www.zdf.de/filme/mein-lotta-leben--alles-tschaka-mit-alpaka-movie-100,https://letterboxd.com/film/my-life-as-lotta-okey-dokey-alpaca/
Greedy People - Gelegenheit macht gierig,ZDF,,Potsy Ponciroli,3.06,,21207,108,23.06.2026,"The eclectic residents of a small, picturesque island town must navigate a sensational murder and the discovery of a million dollars, leading to a series of increasingly bad decisions which upend the once-peaceful community.",https://www.zdf.de/filme/greedy-people---gelegenheit-macht-gierig-movie-100,https://letterboxd.com/film/greedy-people/
Die Witwe Clicquot,3Sat,,Thomas Napper,3.06,,10607,86,04.06.2026,"After her husband's death, Madame Clicquot flouts convention by assuming the reins of their wine business, defying her critics and ultimately revolutionizing the champagne industry, establishing her as one of the world's first great businesswomen.",https://www.3sat.de/film/spielfilm/die-witwe-clicquot-100.html,https://letterboxd.com/film/widow-clicquot/
Die Frau von gegenüber,ARTE.DE,,Patrice Leconte,3.06,,1457,79,17.06.2026,"Abandoned by his wife, Bernard struggles to overcome his grief and settles in a residence for singles. Employed by ""SOS Doctors"", he provides night guards to occupy his insomnia. That's how he is brought one night to help a neighbor, Nadine Foulon, victim of discomfort in the elevator. It turns out that Nadine is also going through a difficult time, since her companion, Terry, a singer-guitarist, has left her. A professional photographer, she can not forget it and has since oscillated between depression and bulimia. Gathered by their pains of heart, these two beings will, with the wire of the confidences, become more intimate ...",https://www.arte.tv/de/videos/129308-000-A/die-frau-von-gegenueber/,https://letterboxd.com/film/singles-1982/
Rogue Trader,3Sat,,James Dearden,3.06,,2843,71,11.10.2025,"Rogue Trader tells the true story of Nick Leeson, an employee of Barings Bank who--after a successful trading run--ends up accumulating $1.4 billion in losses hidden in account #88888.",https://www.3sat.de/film/spielfilm/rogue-trader-100.html,https://letterboxd.com/film/rogue-trader/
Olivia,ZDF,,Ulli Lommel,3.05,,2368,89,15.05.2026,"Nightmares of the past haunt the beautiful, mysterious Olivia, a London resident who begins a passionate affair with American businessman Mike. Trapped in a loveless marriage and traumatized by memories of her mother's brutal murder, Olivia hopes her lover will offer a chance at a new life. However, ghostly voices and brutal murders ignite a fiendish, twist-filled story of double identities, deception, and erotic terror.",https://www.zdf.de/filme/olivia-movie-100,https://letterboxd.com/film/olivia-1983/
Chefs Leckerbissen,ARTE.DE,,Nacho G. Velilla,3.02,,1213,103,25.02.2026,"Maxi thinks his life is perfect. He is a famous cook who owns a successful restaurant in Chueca and is living his life as a gay man without much complex. But when his son Edu and his daughter Alba appear, and a new attractive neighbor comes along, it will have a strong effect on his life resulting in his values being challenged for ever.",https://www.arte.tv/de/videos/130205-000-A/chefs-leckerbissen/,https://letterboxd.com/film/chefs-special/
Plan A – Was würdest du tun?,3Sat,,"Doron Paz, Yoav Paz",3.02,,1197,99,13.03.2026,"Germany 1945, Max, a Jewish Holocaust survivor, meets a radical group of Jewish resistance fighters, who, like him, lost all hope for their future after they were robbed of their existence and their entire families were killed by the Nazis. They dream of retaliation on an epic scale for the Jewish people. An eye for an eye, a tooth for a tooth. Max starts identifying with the group's monstrous plans...",https://www.3sat.de/film/spielfilm/plan-a-was-wuerdest-du-tun-100.html,https://letterboxd.com/film/plan-a/
Jennifer 8,ARTE.DE,,Bruce Robinson,3.01,,8487,120,17.03.2026,"John Berlin, a big-city cop from LA moves to a small-town police force and immediately finds himself investigating a murder. Using theories rejected by his colleagues, Berlin meets a young blind woman named Helena, whom he is attracted to. Meanwhile, a serial killer is on the loose—and only John knows it.",https://www.arte.tv/de/videos/130329-000-A/jennifer-8/,https://letterboxd.com/film/jennifer-eight/
Madame Sidonie in Japan,ARTE.DE,,Elise Girard,3.01,,5129,89,17.06.2026,"Sidonie Perceval, an established French writer, is mourning her deceased husband.  Invited to Japan for the reedition of her first book, she is welcomed by her local editor who takes her to Kyoto, the city of shrines and temples. As they travel together through the Japanese spring blossoms, she slowly opens up to him.  But the ghost of her husband follows Sidonie: she will have to finally let go of the past to let herself love again.",https://www.arte.tv/de/videos/100896-000-A/madame-sidonie-in-japan/,https://letterboxd.com/film/sidonie-in-japan/
Schweigend steht der Wald,3Sat,,Saralisa Volm,3.01,,739,89,23.01.2026,"As a forestry student doing an internship, Anja Grimm ends up in that remote area in the Upper Palatinate Forest, where she went on vacation with her parents as an eight-year-old girl and her father disappeared without a trace. Her job is to take soil samples to create a soil map. At one point in the forest floor she comes across abnormal irregularities. Not long after their arrival, a brutal murder occurs. Anja soon arouses suspicion and hostility not only among the villagers with her suspicion that the perpetrator knows something about her father's fate and with her questions about the atypical soil composition in the forest clearing. Even the police react extremely reservedly to their investigations. And when it turns out that the young woman can read the signs of the forest like an open book, forces mobilize in the village who are apparently ready for anything because there is a dark secret that needs to be kept.",https://www.3sat.de/film/spielfilm/schweigend-steht-der-wald-102.html,https://letterboxd.com/film/the-silent-forest-2022/
Lehrer kann jeder!,ZDF,,Ingo Rasper,2.99,,276,88,16.05.2026,"Richard lives apart from his wife. He is unemployed. His life is really not running smoothly right now. Rather by chance, he gets into conversation with the director of his daughter's school, who is desperately looking for teachers - which gives Richard an idea. He is a mathematician. And after all, everyone can become a teacher!",https://www.zdf.de/filme/lehrer-kann-jeder-movie-100,https://letterboxd.com/film/lehrer-kann-jeder/
Notre Dame - Die Liebe ist eine Baustelle,ARTE.DE,,Valérie Donzelli,2.98,,1562,85,01.04.2026,"Maud is an architect and a mother. Due to a misunderstanding, she wins the competition to refurbish the parvis of Notre-Dame. Torn between these responsibilities and love issues, she will go through an emotional storm.",https://www.arte.tv/de/videos/129910-000-A/notre-dame-die-liebe-ist-eine-baustelle/,https://letterboxd.com/film/notre-dame/
Bleib bei uns,3Sat,,Gad Elmaleh,2.97,,2083,89,25.01.2026,"Gad Elmaleh decides to leave New York and move back to Paris, to get baptized and become a Catholic. Despite his attempt to hide the truth from his Jewish family, Gad's parents discover their son's unconditional love for the Virgin Mary – and for them, it’s a nightmare! Determined to bring Gad back to reason and to his Jewishness, they turn his conversion into a battlefield - as Gad tries to make them understand by any means necessary that his sincere beliefs do not change his identity and the love he has for his family.",https://www.3sat.de/film/spielfilm/bleib-bei-uns-100.html,https://letterboxd.com/film/stay-with-us/
Ein Kind wie Jake,3Sat,,Silas Howard,2.94,,3694,85,19.08.2025,"On the eve of the admissions cycle for New York City kindergartens, Alex and Greg Wheeler have high hopes for four-year-old Jake. The director of Jake's preschool encourages them to accentuate Jake's gender expansive behavior to help him stand out. As Alex and Greg navigate their roles as parents, a rift grows between them, one that forces them to confront their own concerns about what's best for Jake, and each other.",https://www.3sat.de/film/spielfilm/ein-kind-wie-jake-100.html,https://letterboxd.com/film/a-kid-like-jake/
Ein unmoralisches Angebot,ARD,,Adrian Lyne,2.9,,66366,109,16.06.2026,John Gage offers a down-on-his-luck yuppie husband $1 million for the opportunity to spend the night with the man's wife.,https://www.ardmediathek.de/video/Y3JpZDovL2FyZC5kZS9wbGFuQVJEXzA2NjI1ZDEwLTFkYWMtNDY3Zi04N2VjLTVmNjEwMGI1ZGZiOV9nYW56ZVNlbmR1bmc,https://letterboxd.com/film/indecent-proposal/
Ein unmoralisches Angebot,3Sat,,Adrian Lyne,2.9,,66366,109,26.06.2026,John Gage offers a down-on-his-luck yuppie husband $1 million for the opportunity to spend the night with the man's wife.,https://www.3sat.de/film/spielfilm/ein-unmoralisches-angebot-100.html,https://letterboxd.com/film/indecent-proposal/
Kalt erwischt,ARTE.DE,,Emmanuelle Cuau,2.9,,1003,82,04.03.2026,A single mother gets entangled in a web of lies to protect her sons.,https://www.arte.tv/de/videos/129911-000-A/kalt-erwischt/,https://letterboxd.com/film/not-on-my-watch/
